PaperID,DOI,Year,url,Title
790,10.1115/DETC2008-50017,2008,http://proceedings.asmedigitalcollection.asme.org//proceeding.aspx?articleID=1627208,"A Finite Element Approach for the Implementation of Magnetostrictive Material Terfenol-D in CNG Fuel Injection Actuation"
791,10.1115/DETC2008-50054,2008,http://proceedings.asmedigitalcollection.asme.org//proceeding.aspx?articleID=1627213,"Parametric Modeling and Optimization of Chemical Vapor Deposition Process"
792,10.1115/DETC2008-49558,2008,http://proceedings.asmedigitalcollection.asme.org//proceeding.aspx?articleID=1627215,"Optimization Design of a Spatial Six-Degree-of-Freedom Parallel Manipulator Based on Genetic Algorithms and Neural Networks"
793,10.1115/DETC2008-49645,2008,http://proceedings.asmedigitalcollection.asme.org//proceeding.aspx?articleID=1627218,"Optimal Kinematics Design of an Industrial Robot Family"
794,10.1115/DETC2008-50093,2008,http://proceedings.asmedigitalcollection.asme.org//proceeding.aspx?articleID=1627220,"Topology and Dimensional Synthesis of Linkage Mechanism Based on the Constrained Superposition Method"
795,10.1115/DETC2008-50137,2008,http://proceedings.asmedigitalcollection.asme.org//proceeding.aspx?articleID=1627224,"Genetic Programming of an Artificial Neural Network for Robust Control of a 2-D Path Following Robot"
796,10.1115/DETC2008-49356,2008,http://proceedings.asmedigitalcollection.asme.org//proceeding.aspx?articleID=1627227,"Decision Support for Strategic Redesign"
797,10.1115/DETC2008-49395,2008,http://proceedings.asmedigitalcollection.asme.org//proceeding.aspx?articleID=1627232,"Designing Embodiment Design Processes Using a Value-of-Information-Based Approach With Applications for Integrated Product and Materials Design"
798,10.1115/DETC2008-49734,2008,http://proceedings.asmedigitalcollection.asme.org//proceeding.aspx?articleID=1627235,"Knowledge Management for Fault Tree Analysis Based on Quantity Dimension Indexing"
799,10.1115/DETC2008-49240,2008,http://proceedings.asmedigitalcollection.asme.org//proceeding.aspx?articleID=1627238,"Using Multiple Surrogates for Minimization of the RMS Error in Meta-Modeling"
800,10.1115/DETC2008-49479,2008,http://proceedings.asmedigitalcollection.asme.org//proceeding.aspx?articleID=1627241,"Optimization of Engine Torque Management Under Uncertainty for Vehicle Driveline Clunk Using Time-Dependent Metamodels"
801,10.1115/DETC2008-49994,2008,http://proceedings.asmedigitalcollection.asme.org//proceeding.aspx?articleID=1627243,"A Practical Robust and Efficient RBF Metamodel Method for Typical Engineering Problems"
802,10.1115/DETC2008-50061,2008,http://proceedings.asmedigitalcollection.asme.org//proceeding.aspx?articleID=1627248,"A Study of Covariance Functions for Multi-Response Metamodeling for Simulation-Based Design and Optimization"
803,10.1115/DETC2008-49148,2008,http://proceedings.asmedigitalcollection.asme.org//proceeding.aspx?articleID=1627250,"A Sequential Linearization Technique for Analytical Target Cascading"
804,10.1115/DETC2008-49444,2008,http://proceedings.asmedigitalcollection.asme.org//proceeding.aspx?articleID=1627254,"Parallel Implementation of Particle Swarm Optimization (PSO) Through Digital Pheromone Sharing"
805,10.1115/DETC2008-49823,2008,http://proceedings.asmedigitalcollection.asme.org//proceeding.aspx?articleID=1627256,"Consistency Constraint Allocation in Augmented Lagrangian Coordination"
806,10.1115/DETC2008-50038,2008,http://proceedings.asmedigitalcollection.asme.org//proceeding.aspx?articleID=1627260,"Enhanced Collaborative Optimization: A Decomposition-Based Method for Multidisciplinary Design"
807,10.1115/DETC2008-49425,2008,http://proceedings.asmedigitalcollection.asme.org//proceeding.aspx?articleID=1627261,"Multiobjective Optimization Method for Lifecycle Design of Machine Products"
808,10.1115/DETC2008-49435,2008,http://proceedings.asmedigitalcollection.asme.org//proceeding.aspx?articleID=1627264,"Fundamental Strategies for System Optimization of Machine Product Designs"
809,10.1115/DETC2008-49871,2008,http://proceedings.asmedigitalcollection.asme.org//proceeding.aspx?articleID=1627266,"Multi-Objective Optimization of Product Configuration"
810,10.1115/DETC2008-50027,2008,http://proceedings.asmedigitalcollection.asme.org//proceeding.aspx?articleID=1627270,"Plug-In Hybrid Vehicle Simulation: How Battery Weight and Charging Patterns Impact Cost, Fuel Consumption, and CO2 Emissions"
811,10.1115/DETC2008-50068,2008,http://proceedings.asmedigitalcollection.asme.org//proceeding.aspx?articleID=1627274,"Heat Compensation in Buildings Using Thermoelectric Windows: An Energy Efficient Window Technology"
812,10.1115/DETC2008-49239,2008,http://proceedings.asmedigitalcollection.asme.org//proceeding.aspx?articleID=1627276,"The Application of Product Platform Design to the Reuse of Electronic Components Subject to Long-Term Supply Chain Disruptions"
813,10.1115/DETC2008-49335,2008,http://proceedings.asmedigitalcollection.asme.org//proceeding.aspx?articleID=1627279,"Product Family Commonality Selection Through Interactive Visualization"
814,10.1115/DETC2008-49428,2008,http://proceedings.asmedigitalcollection.asme.org//proceeding.aspx?articleID=1627282,"Assessing Functional and Shape Differentiation Within a Family of Products"
815,10.1115/DETC2008-49429,2008,http://proceedings.asmedigitalcollection.asme.org//proceeding.aspx?articleID=1627287,"Product Family Design: Strategic Principles to Choose Between Product-Driven and Platform-Driven Processes"
816,10.1115/DETC2008-49544,2008,http://proceedings.asmedigitalcollection.asme.org//proceeding.aspx?articleID=1627289,"Improving Cost Effectiveness in an Existing Product Line Using Component Product Platforms"
817,10.1115/DETC2008-49597,2008,http://proceedings.asmedigitalcollection.asme.org//proceeding.aspx?articleID=1627292,"Focused Product Family Improvement"
818,10.1115/DETC2008-49683,2008,http://proceedings.asmedigitalcollection.asme.org//proceeding.aspx?articleID=1627293,"A Strategic Module-Based Platform Design Method for Developing Customized Products in Dynamic and Uncertain Market Environments"
819,10.1115/DETC2008-49739,2008,http://proceedings.asmedigitalcollection.asme.org//proceeding.aspx?articleID=1627298,"Functional Part Families and Design Change for Mechanical Assemblies"
820,10.1115/DETC2008-50023,2008,http://proceedings.asmedigitalcollection.asme.org//proceeding.aspx?articleID=1627301,"Optimal Design of Product Family Throughout Commonalization, Customization and Lineup Arrangement"
821,10.1115/DETC2008-49156,2008,http://proceedings.asmedigitalcollection.asme.org//proceeding.aspx?articleID=1627303,"An Efficient Re-Analysis Methodology for Probabilistic Vibration of Large-Scale Structures"
822,10.1115/DETC2008-49168,2008,http://proceedings.asmedigitalcollection.asme.org//proceeding.aspx?articleID=1627307,"Uncertainty Analysis of Damage Evolution Computed Through Microstructure-Property Relations"
823,10.1115/DETC2008-49415,2008,http://proceedings.asmedigitalcollection.asme.org//proceeding.aspx?articleID=1627309,"Reliability-Based Shape Optimization of a Pressure Tank Under Random and Stochastic Environments"
824,10.1115/DETC2008-49493,2008,http://proceedings.asmedigitalcollection.asme.org//proceeding.aspx?articleID=1627312,"Sensitivity Analyses of FORM-Based and DRM-Based Performance Measure Approach for Reliability-Based Design Optimization"
825,10.1115/DETC2008-49494,2008,http://proceedings.asmedigitalcollection.asme.org//proceeding.aspx?articleID=1627316,"Selection of Copula to Generate Input Joint CDF for RBDO"
826,10.1115/DETC2008-49098,2008,http://proceedings.asmedigitalcollection.asme.org//proceeding.aspx?articleID=1627318,"Topology Optimization for Steady-State Heat Transfer Problems Including Design-Dependent Effects"
828,10.1115/DETC2008-49134,2008,http://proceedings.asmedigitalcollection.asme.org//proceeding.aspx?articleID=1627322,"Topology Optimization of Multiple Parts in Dynamic Controlled Systems"
829,10.1115/DETC2008-49187,2008,http://proceedings.asmedigitalcollection.asme.org//proceeding.aspx?articleID=1627326,"An Improved Initial Population Strategy for Compliant Mechanism Designs Using Evolutionary Optimization"
830,10.1115/DETC2008-49394,2008,http://proceedings.asmedigitalcollection.asme.org//proceeding.aspx?articleID=1627331,"On Pattern Recognition in Rule-Based Topology Modification"
831,10.1115/DETC2008-49563,2008,http://proceedings.asmedigitalcollection.asme.org//proceeding.aspx?articleID=1627333,"Topology Optimization of a MEMS Resonator Using Hybrid Fuzzy Techniques"
832,10.1115/DETC2008-49582,2008,http://proceedings.asmedigitalcollection.asme.org//proceeding.aspx?articleID=1627337,"Topology Optimization of Poroelastic Structures to Minimize Mean Sound Pressure Levels"
833,10.1115/DETC2008-49618,2008,http://proceedings.asmedigitalcollection.asme.org//proceeding.aspx?articleID=1627341,"Design of Compliant Thermal Actuators Using Structural Optimization Based on the Level Set Method"
834,10.1115/DETC2008-49857,2008,http://proceedings.asmedigitalcollection.asme.org//proceeding.aspx?articleID=1627346,"Design Automation Tools as a Support for Knowledge Management in Topology Optimization"
836,10.1115/DETC2008-50037,2008,http://proceedings.asmedigitalcollection.asme.org//proceeding.aspx?articleID=1627350,"Topology Synthesis of Multi-Component Structural Assemblies in Continuum Domains"
837,10.1115/DETC2008-50106,2008,http://proceedings.asmedigitalcollection.asme.org//proceeding.aspx?articleID=1627352,"Layer Separation for Optimization of Composite Laminates"
838,10.1115/DETC2008-49336,2008,http://proceedings.asmedigitalcollection.asme.org//proceeding.aspx?articleID=1627355,"Model Validation and Error Modeling to Support Sequential Sampling"
839,10.1115/DETC2008-49662,2008,http://proceedings.asmedigitalcollection.asme.org//proceeding.aspx?articleID=1627357,"Regression Modeling for Computer Model Validation With Functional Responses"
840,10.1115/DETC2008-49669,2008,http://proceedings.asmedigitalcollection.asme.org//proceeding.aspx?articleID=1627361,"A Comprehensive Metric for Comparing Time Histories in Validation of Simulation Models With Emphasis on Vehicle Safety Applications"
841,10.1115/DETC2007-35012,2007,http://proceedings.asmedigitalcollection.asme.org//proceeding.aspx?articleID=1604630,"Overlapped Grouping Genetic Algorithm for Optimization of Reels Cutting Planning Problems"
842,10.1115/DETC2007-35189,2007,http://proceedings.asmedigitalcollection.asme.org//proceeding.aspx?articleID=1604632,"A Perspective of Hierarchical Layout Design Optimization for Highly Packaged Equipments"
843,10.1115/DETC2007-35497,2007,http://proceedings.asmedigitalcollection.asme.org//proceeding.aspx?articleID=1604636,"A Genetic Algorithm Based Procedure for Extracting Optimal Solutions From a Morphological Chart"
845,10.1115/DETC2007-35913,2007,http://proceedings.asmedigitalcollection.asme.org//proceeding.aspx?articleID=1604637,"A Variable Fidelity Model Management Framework for Multiscale Computational Design of Continuous Fiber SiC-Si3N4 Ceramic Composites"
846,10.1115/DETC2007-35914,2007,http://proceedings.asmedigitalcollection.asme.org//proceeding.aspx?articleID=1604639,"Topology Optimization for Synthesizing Extrusion Based Nonlinear Transient Designs"
847,10.1115/DETC2007-34587,2007,http://proceedings.asmedigitalcollection.asme.org//proceeding.aspx?articleID=1604641,"An Intelligent and Efficient Tree Search Algorithm for Computer-Aided Component Selection"
848,10.1115/DETC2007-34588,2007,http://proceedings.asmedigitalcollection.asme.org//proceeding.aspx?articleID=1604643,"A Graph Grammar Approach to Generate Neural Network Topologies"
849,10.1115/DETC2007-34718,2007,http://proceedings.asmedigitalcollection.asme.org//proceeding.aspx?articleID=1604646,"A Learning Algorithm for Optimal Internal Combustion Engine Calibration in Real Time"
850,10.1115/DETC2007-34769,2007,http://proceedings.asmedigitalcollection.asme.org//proceeding.aspx?articleID=1604648,"A Simplified Systematic Method of Acquiring Design Specifications From Customer Requirements"
851,10.1115/DETC2007-35373,2007,http://proceedings.asmedigitalcollection.asme.org//proceeding.aspx?articleID=1604650,"Towards a Reference Ontology for Functional Knowledge Interoperability"
852,10.1115/DETC2007-34631,2007,http://proceedings.asmedigitalcollection.asme.org//proceeding.aspx?articleID=1604651,"Fuzzy Analytical Hierarchy Process-Based Assembly Unit Partition for Complex Products"
853,10.1115/DETC2007-34723,2007,http://proceedings.asmedigitalcollection.asme.org//proceeding.aspx?articleID=1604653,"PDM Implementation in Indian Industries: An Impact Study on Technology Adoption"
854,10.1115/DETC2007-34727,2007,http://proceedings.asmedigitalcollection.asme.org//proceeding.aspx?articleID=1604655,"A Framework for Collaborative Top-Down Assembly Design"
855,10.1115/DETC2007-34842,2007,http://proceedings.asmedigitalcollection.asme.org//proceeding.aspx?articleID=1604658,"A Design Strategy for Collaborative Decision Making in a Distributed Environment"
856,10.1115/DETC2007-35534,2007,http://proceedings.asmedigitalcollection.asme.org//proceeding.aspx?articleID=1604659,"An Approach to Improved Decentralized Design: The Modified Approximation-Based Decentralized Design (MADD) Framework"
857,10.1115/DETC2007-34883,2007,http://proceedings.asmedigitalcollection.asme.org//proceeding.aspx?articleID=1604661,"Design Optimization of a Laptop Computer Using Aggregate and Mixed Logit Demand Models With Consumer Survey Data"
858,10.1115/DETC2007-34884,2007,http://proceedings.asmedigitalcollection.asme.org//proceeding.aspx?articleID=1604663,"A Game-Theoretic Approach to Finding Market Equilibria for Automotive Design Under Environmental Regulation"
859,10.1115/DETC2007-35409,2007,http://proceedings.asmedigitalcollection.asme.org//proceeding.aspx?articleID=1604664,"Measurement of Headlight Form Preference Using a Choice Based Conjoint Analysis"
860,10.1115/DETC2007-35568,2007,http://proceedings.asmedigitalcollection.asme.org//proceeding.aspx?articleID=1604667,"Conjoint-HoQ: A Quantitative Methodology for Consumer-Driven Design"
861,10.1115/DETC2007-35580,2007,http://proceedings.asmedigitalcollection.asme.org//proceeding.aspx?articleID=1604669,"Preference Inconsistency in Multidisciplinary Design Decision Making"
862,10.1115/DETC2007-34301,2007,http://proceedings.asmedigitalcollection.asme.org//proceeding.aspx?articleID=1604671,"Theoretical Design and Control Analysis of Reconfigurable Parallel Kinematic Machine Tools"
863,10.1115/DETC2007-35179,2007,http://proceedings.asmedigitalcollection.asme.org//proceeding.aspx?articleID=1604672,"Design for Product Adaptability"
864,10.1115/DETC2007-35745,2007,http://proceedings.asmedigitalcollection.asme.org//proceeding.aspx?articleID=1604675,"Flexible and Reconfigurable Systems: Nomenclature and Review"
865,10.1115/DETC2007-34773,2007,http://proceedings.asmedigitalcollection.asme.org//proceeding.aspx?articleID=1604677,"Adaptive Complex Method for Efficient Design Optimization"
866,10.1115/DETC2007-34839,2007,http://proceedings.asmedigitalcollection.asme.org//proceeding.aspx?articleID=1604679,"Approximated Unimodal Region Elimination Based Global Optimization Method for Engineering Design"
867,10.1115/DETC2007-34926,2007,http://proceedings.asmedigitalcollection.asme.org//proceeding.aspx?articleID=1604681,"Bayesian Analysis of Adaptive One-Factor-at-a-Time Experimentation"
868,10.1115/DETC2007-35506,2007,http://proceedings.asmedigitalcollection.asme.org//proceeding.aspx?articleID=1604682,"Multi Agent Normal Sampling Technique (MANST) for Global Optimization"
869,10.1115/DETC2007-35554,2007,http://proceedings.asmedigitalcollection.asme.org//proceeding.aspx?articleID=1604685,"Non-Dominated Sorting Genetic Quantum Algorithm for Multi-Objective Optimization"
870,10.1115/DETC2007-34157,2007,http://proceedings.asmedigitalcollection.asme.org//proceeding.aspx?articleID=1604687,"Optimization of a Vehicle Space Frame Under Ballistic Impact Loading"
871,10.1115/DETC2007-34918,2007,http://proceedings.asmedigitalcollection.asme.org//proceeding.aspx?articleID=1604689,"Optimization of Bicycle Frames Using Genetic Algorithms"
872,10.1115/DETC2007-35353,2007,http://proceedings.asmedigitalcollection.asme.org//proceeding.aspx?articleID=1604691,"Generalization of Topological Sensitivity and Its Application to Defeaturing"
873,10.1115/DETC2007-35482,2007,http://proceedings.asmedigitalcollection.asme.org//proceeding.aspx?articleID=1604693,"A Hybrid Method for Surrogate Model Updating in Engineering Design Optimization"
874,10.1115/DETC2007-35825,2007,http://proceedings.asmedigitalcollection.asme.org//proceeding.aspx?articleID=1604695,"Pseudo-Hierarchical Multistage Model for System of Systems Design and Operations"
875,10.1115/DETC2007-34940,2007,http://proceedings.asmedigitalcollection.asme.org//proceeding.aspx?articleID=1604697,"Finite Element Analysis Applied to Ergonomic Design of 2-Piece Aluminum Beverage Cans and Bottles"
876,10.1115/DETC2007-35479,2007,http://proceedings.asmedigitalcollection.asme.org//proceeding.aspx?articleID=1604699,"Including Preference in Anthropometry-Driven Models for Design"
877,10.1115/DETC2007-35637,2007,http://proceedings.asmedigitalcollection.asme.org//proceeding.aspx?articleID=1604701,"Evaluation Method of Drinking Ease for Aluminum Beverage Bottles"
878,10.1115/DETC2007-34445,2007,http://proceedings.asmedigitalcollection.asme.org//proceeding.aspx?articleID=1604703,"Adaptive Deposition Coverage Toolpath Planning for Metal Deposition Process"
879,10.1115/DETC2007-34691,2007,http://proceedings.asmedigitalcollection.asme.org//proceeding.aspx?articleID=1604705,"Automated Synthesis of MEMS Fabrication Sequences Using Graph Grammars"
880,10.1115/DETC2007-35665,2007,http://proceedings.asmedigitalcollection.asme.org//proceeding.aspx?articleID=1604707,"Adaptive Slicing of Moving Least Squares Surfaces: Toward Direct Manufacturing of Point Set Surfaces"
881,10.1115/DETC2007-35827,2007,http://proceedings.asmedigitalcollection.asme.org//proceeding.aspx?articleID=1604708,"Product Reverse Engineering Based on Growth Design Process"
882,10.1115/DETC2007-34285,2007,http://proceedings.asmedigitalcollection.asme.org//proceeding.aspx?articleID=1604711,"High Performance Dirichlet Parametrization Through Triangular Bezier Surface Interpolation for Deformation of CAE Meshes"
883,10.1115/DETC2007-34597,2007,http://proceedings.asmedigitalcollection.asme.org//proceeding.aspx?articleID=1604713,"Curve Shape Modification and Fairness Evaluation"
884,10.1115/DETC2007-34636,2007,http://proceedings.asmedigitalcollection.asme.org//proceeding.aspx?articleID=1604715,"Application of Interactive Deformation to Assembled Mesh Models for CAE Analysis"
885,10.1115/DETC2007-34685,2007,http://proceedings.asmedigitalcollection.asme.org//proceeding.aspx?articleID=1604717,"Pre-Programmed Failure Behavior Using Biology-Inspired Structures"
886,10.1115/DETC2007-34688,2007,http://proceedings.asmedigitalcollection.asme.org//proceeding.aspx?articleID=1604720,"Finding All Undercut-Free Parting Directions for Solids of Revolution"
887,10.1115/DETC2007-34703,2007,http://proceedings.asmedigitalcollection.asme.org//proceeding.aspx?articleID=1604722,"Wavelet SDF-Reps: Solid Modeling With Volumetric Scans"
888,10.1115/DETC2007-34746,2007,http://proceedings.asmedigitalcollection.asme.org//proceeding.aspx?articleID=1604724,"Matching Geometric Shapes in 4D Space Incorporating Curvature Information"
889,10.1115/DETC2007-34826,2007,http://proceedings.asmedigitalcollection.asme.org//proceeding.aspx?articleID=1604726,"Motion-Based Shape Deformation of Solid Models"
890,10.1115/DETC2007-34827,2007,http://proceedings.asmedigitalcollection.asme.org//proceeding.aspx?articleID=1604729,"A Point Membership Classification for Sweeping Solids"
891,10.1115/DETC2007-35171,2007,http://proceedings.asmedigitalcollection.asme.org//proceeding.aspx?articleID=1604731,"Quasi-Optimal Mesh Segmentation Via Region Growing/Merging"
892,10.1115/DETC2007-34124,2007,http://proceedings.asmedigitalcollection.asme.org//proceeding.aspx?articleID=1604733,"Development of Validation Metrics for Vehicle Frontal Impact Simulation"
894,10.1115/DETC2007-34421,2007,http://proceedings.asmedigitalcollection.asme.org//proceeding.aspx?articleID=1604735,"A Development Methodology for Parametric Synthesis Tools"
895,10.1115/DETC2007-35520,2007,http://proceedings.asmedigitalcollection.asme.org//proceeding.aspx?articleID=1604738,"Incorporating Customer Preferences and Market Trends in Vehicle Package Design"
896,10.1115/DETC2007-35610,2007,http://proceedings.asmedigitalcollection.asme.org//proceeding.aspx?articleID=1604740,"A Case Study of Design Process and Development of a Design Enabling Tool for Wright Metal Products"
897,10.1115/DETC2007-34687,2007,http://proceedings.asmedigitalcollection.asme.org//proceeding.aspx?articleID=1604742,"A Process Model and Data Mining to Support Designing Families of Services"
898,10.1115/DETC2007-35133,2007,http://proceedings.asmedigitalcollection.asme.org//proceeding.aspx?articleID=1604744,"Quantity Dimension Indexing for Design Knowledge Management"
899,10.1115/DETC2007-35483,2007,http://proceedings.asmedigitalcollection.asme.org//proceeding.aspx?articleID=1604746,"Representation and Analysis Challenges in Design for Part-Reuse: An Automotive Case Study"
900,10.1115/DETC2007-35606,2007,http://proceedings.asmedigitalcollection.asme.org//proceeding.aspx?articleID=1604749,"Empirical Models for Non-Deterministic Simulation-Based Robust Design"
901,10.1115/DETC2007-35686,2007,http://proceedings.asmedigitalcollection.asme.org//proceeding.aspx?articleID=1604751,"Managing Design Process Complexity: A Value-of-Information Based Approach for Scale and Decision Decoupling"
902,10.1115/DETC2007-34520,2007,http://proceedings.asmedigitalcollection.asme.org//proceeding.aspx?articleID=1604753,"Q2S2: Merging Qualitative Information in Sequential DOE"
903,10.1115/DETC2007-34662,2007,http://proceedings.asmedigitalcollection.asme.org//proceeding.aspx?articleID=1604755,"Using Maximum Likelihood Estimation to Estimate Kriging Model Parameters"
904,10.1115/DETC2007-34674,2007,http://proceedings.asmedigitalcollection.asme.org//proceeding.aspx?articleID=1604757,"Reducing the Number of Variables in a Response Surface Approximation: Application to Thermal Design"
905,10.1115/DETC2007-35504,2007,http://proceedings.asmedigitalcollection.asme.org//proceeding.aspx?articleID=1604758,"Reduction of Non-Monomial Basis in the Dimensional Analysis of a Dynamical System"
906,10.1115/DETC2007-35782,2007,http://proceedings.asmedigitalcollection.asme.org//proceeding.aspx?articleID=1604761,"A New Variable Fidelity Optimization Framework Based on Model Fusion and Objective-Oriented Sequential Sampling"
907,10.1115/DETC2007-34698,2007,http://proceedings.asmedigitalcollection.asme.org//proceeding.aspx?articleID=1604763,"Optimal Partitioning and Coordination Decisions in Decomposition-Based Design Optimization"
908,10.1115/DETC2007-34818,2007,http://proceedings.asmedigitalcollection.asme.org//proceeding.aspx?articleID=1604765,"Multiobjective Collaborative Robust Optimization (McRO) With Interval Uncertainty and Interdisciplinary Uncertainty Propagation"
909,10.1115/DETC2007-35152,2007,http://proceedings.asmedigitalcollection.asme.org//proceeding.aspx?articleID=1604767,"Integrated Structure Decomposition, Optimization and Control Design"
910,10.1115/DETC2007-35361,2007,http://proceedings.asmedigitalcollection.asme.org//proceeding.aspx?articleID=1604769,"A Sequential Linear Programming Coordination Algorithm for Analytical Target Cascading"
911,10.1115/DETC2007-35566,2007,http://proceedings.asmedigitalcollection.asme.org//proceeding.aspx?articleID=1604770,"Diagonal Quadratic Approximation for Parallelization of Analytical Target Cascading"
912,10.1115/DETC2007-34299,2007,http://proceedings.asmedigitalcollection.asme.org//proceeding.aspx?articleID=1604774,"A Concept for a Material That Softens With Frequency"
913,10.1115/DETC2007-35447,2007,http://proceedings.asmedigitalcollection.asme.org//proceeding.aspx?articleID=1604776,"A Template-Based Approach for Multilevel Blast Resistant Panel Design"
914,10.1115/DETC2007-35608,2007,http://proceedings.asmedigitalcollection.asme.org//proceeding.aspx?articleID=1604777,"Predictive Carbon Nanotube Models Using the Eigenvector Dimension Reduction (EDR) Method"
915,10.1115/DETC2007-35743,2007,http://proceedings.asmedigitalcollection.asme.org//proceeding.aspx?articleID=1604779,"A Function-Based Approach for Integrated Design of Material and Product Concepts"
916,10.1115/DETC2007-34796,2007,http://proceedings.asmedigitalcollection.asme.org//proceeding.aspx?articleID=1604781,"A Dual Environment for 3D Modeling With User-Defined Free Form Features"
917,10.1115/DETC2007-34970,2007,http://proceedings.asmedigitalcollection.asme.org//proceeding.aspx?articleID=1604784,"Reverse Engineering of Geometric Surfaces Using Tabu Search Optimization Technique"
918,10.1115/DETC2007-35010,2007,http://proceedings.asmedigitalcollection.asme.org//proceeding.aspx?articleID=1604786,"Correspondences Matching on 3D Mesh Models"
919,10.1115/DETC2007-35187,2007,http://proceedings.asmedigitalcollection.asme.org//proceeding.aspx?articleID=1604788,"Procedural Design of Imprint Rolls for Fluid Pathway Fabrication"
920,10.1115/DETC2007-35723,2007,http://proceedings.asmedigitalcollection.asme.org//proceeding.aspx?articleID=1604790,"OAM+: An Assembly Data Model for Legacy Systems Engineering"
921,10.1115/DETC2007-34591,2007,http://proceedings.asmedigitalcollection.asme.org//proceeding.aspx?articleID=1604791,"Robust Product Design Optimization Method Using Hierarchical Representations of Characteristics"
922,10.1115/DETC2007-34708,2007,http://proceedings.asmedigitalcollection.asme.org//proceeding.aspx?articleID=1604794,"An Optimal Design Method for Reducing Brake Squeal in Disc Brake Systems"
