PaperID,DOI,Year,url,Title
386,10.1115/DETC2011-48513,2011,http://proceedings.asmedigitalcollection.asme.org//proceeding.aspx?articleID=1640597,"Optimal Component Sizing and Forward-Looking Dispatch of an Electrical Microgrid for Energy Storage Planning"
387,10.1115/DETC2011-48582,2011,http://proceedings.asmedigitalcollection.asme.org//proceeding.aspx?articleID=1640600,"Optimal Scheduling of Parabolic Heliostats Aim Targets in a Mini-Tower Solar Concentrator System"
388,10.1115/DETC2011-48591,2011,http://proceedings.asmedigitalcollection.asme.org//proceeding.aspx?articleID=1640601,"Optimization of Parabolic Heliostat Focal Lengths in a Mini-Tower Solar Concentrator System"
389,10.1115/DETC2011-48731,2011,http://proceedings.asmedigitalcollection.asme.org//proceeding.aspx?articleID=1640604,"Characterizing the Influence of Land Configuration on the Optimal Wind Farm Performance"
390,10.1115/DETC2011-47927,2011,http://proceedings.asmedigitalcollection.asme.org//proceeding.aspx?articleID=1640607,"Customer Driven Optimal Design for Convergence Products"
391,10.1115/DETC2011-48007,2011,http://proceedings.asmedigitalcollection.asme.org//proceeding.aspx?articleID=1640609,"Defining Technology-Adoption Indifference Curves for Residential Solar Electricity Generation Using Stated Preference Experiments"
392,10.1115/DETC2011-48338,2011,http://proceedings.asmedigitalcollection.asme.org//proceeding.aspx?articleID=1640611,"Customer-Driven Product Design Selection Using Web Based User-Generated Content"
393,10.1115/DETC2011-48409,2011,http://proceedings.asmedigitalcollection.asme.org//proceeding.aspx?articleID=1640615,"Robust Design for Profit Maximization Under Uncertainty of Consumer Choice Model Parameters Using the Delta Method"
394,10.1115/DETC2011-47409,2011,http://proceedings.asmedigitalcollection.asme.org//proceeding.aspx?articleID=1640616,"A Method for Designing Collaborative Products With Application to Poverty Alleviation"
395,10.1115/DETC2011-48245,2011,http://proceedings.asmedigitalcollection.asme.org//proceeding.aspx?articleID=1640618,"Principles of Mechanical Design for the Developing World: A Case Study Approach"
396,10.1115/DETC2011-48584,2011,http://proceedings.asmedigitalcollection.asme.org//proceeding.aspx?articleID=1640621,"A Method for Identifying Design Principles for the Developing World"
397,10.1115/DETC2011-48669,2011,http://proceedings.asmedigitalcollection.asme.org//proceeding.aspx?articleID=1640622,"Understanding Rural Village Energy Needs and Design Constraints"
398,10.1115/DETC2011-47655,2011,http://proceedings.asmedigitalcollection.asme.org//proceeding.aspx?articleID=1640626,"Managing Uncertainty in Multiscale Systems via Simulation Model Refinement"
399,10.1115/DETC2011-47750,2011,http://proceedings.asmedigitalcollection.asme.org//proceeding.aspx?articleID=1640629,"Loci Surface Guided Crystal Phase Transition Pathway Search"
400,10.1115/DETC2011-48323,2011,http://proceedings.asmedigitalcollection.asme.org//proceeding.aspx?articleID=1640632,"Microstructure Reconstruction for Stochastic Multiscale Material Design"
401,10.1115/DETC2011-48404,2011,http://proceedings.asmedigitalcollection.asme.org//proceeding.aspx?articleID=1640636,"Identifying Product Scaling Principles: A Tool for Bioinspired Design and Beyond"
404,10.1115/DETC2011-47057,2011,http://proceedings.asmedigitalcollection.asme.org//proceeding.aspx?articleID=1640639,"Study of the Sequential Constraint-Handling Technique for Evolutionary Optimization With Application to Structural Problems"
405,10.1115/DETC2011-47130,2011,http://proceedings.asmedigitalcollection.asme.org//proceeding.aspx?articleID=1640642,"Comparison of Gene Expression Programming and Common Metamodeling Techniques in Engineering Design"
406,10.1115/DETC2011-47766,2011,http://proceedings.asmedigitalcollection.asme.org//proceeding.aspx?articleID=1640644,"Methodology for Pipeline Route Selection Using the NSGA II and Distance Transform Algorithms"
407,10.1115/DETC2011-47925,2011,http://proceedings.asmedigitalcollection.asme.org//proceeding.aspx?articleID=1640646,"Interactive Modular Optimization Strategy for Layout Problems"
408,10.1115/DETC2011-48636,2011,http://proceedings.asmedigitalcollection.asme.org//proceeding.aspx?articleID=1640648,"Assessing the Effectiveness of Using Graveyard Data for Generating Design Alternatives"
409,10.1115/DETC2011-47853,2011,http://proceedings.asmedigitalcollection.asme.org//proceeding.aspx?articleID=1640650,"Global Product Family Design: A Mathematical Model for Simultaneous Decision of Module Commonalization and Supply Chain Configuration"
410,10.1115/DETC2011-48316,2011,http://proceedings.asmedigitalcollection.asme.org//proceeding.aspx?articleID=1640652,"Design Preference Elicitation Using Efficient Global Optimization"
411,10.1115/DETC2011-48642,2011,http://proceedings.asmedigitalcollection.asme.org//proceeding.aspx?articleID=1640656,"Learning Stylistic Desires and Generating Preferred Designs of Consumers Using Neural Networks and Genetic Algorithms"
412,10.1115/DETC2011-48742,2011,http://proceedings.asmedigitalcollection.asme.org//proceeding.aspx?articleID=1640658,"Exploring Marketing to Engineering Information Mapping in Mass Customization: A Presentation of Ideas, Challenges and Resulting Questions"
413,10.1115/DETC2011-48919,2011,http://proceedings.asmedigitalcollection.asme.org//proceeding.aspx?articleID=1640660,"Prospect of Design for Mass Customization and Personalization"
414,10.1115/DETC2011-47037,2011,http://proceedings.asmedigitalcollection.asme.org//proceeding.aspx?articleID=1640662,"Structural Topology Optimization for Forced Vibration Problem Using Level Set Method"
415,10.1115/DETC2011-47507,2011,http://proceedings.asmedigitalcollection.asme.org//proceeding.aspx?articleID=1640664,"Modeling of Geometric Variations for Line-Profiles"
416,10.1115/DETC2011-47555,2011,http://proceedings.asmedigitalcollection.asme.org//proceeding.aspx?articleID=1640667,"An Approach to Automated Conversion From Design Feature Model to Analysis Feature Model"
417,10.1115/DETC2011-47908,2011,http://proceedings.asmedigitalcollection.asme.org//proceeding.aspx?articleID=1640670,"Generic Visual Simulation of Manufacturing Equipment"
418,10.1115/DETC2011-48324,2011,http://proceedings.asmedigitalcollection.asme.org//proceeding.aspx?articleID=1640673,"Conceptual Design of Freeform Surfaces From Unstructured Point Sets Using Neural Network Regression"
420,10.1115/DETC2011-48363,2011,http://proceedings.asmedigitalcollection.asme.org//proceeding.aspx?articleID=1640675,"Shape and Topology Optimization With Medial Zones"
422,10.1115/DETC2011-48393,2011,http://proceedings.asmedigitalcollection.asme.org//proceeding.aspx?articleID=1640678,"Evaluating Genetic Algorithms on Welding Sequence Optimization With Respect to Dimensional Variation and Cycle Time"
423,10.1115/DETC2011-48414,2011,http://proceedings.asmedigitalcollection.asme.org//proceeding.aspx?articleID=1640680,"Approximate Surfacing of Curve Clouds for Conceptual Shape Creation and Evaluation"
424,10.1115/DETC2011-48680,2011,http://proceedings.asmedigitalcollection.asme.org//proceeding.aspx?articleID=1640682,"APIX: Analysis From Pixellated Inputs in Early Design Using a Pen-Based Interface"
425,10.1115/DETC2011-48227,2011,http://proceedings.asmedigitalcollection.asme.org//proceeding.aspx?articleID=1640685,"A Rational Design Approach to Gaussian Process Modeling for Variable Fidelity Models"
426,10.1115/DETC2011-48435,2011,http://proceedings.asmedigitalcollection.asme.org//proceeding.aspx?articleID=1640688,"An Improved Support Vector Domain Description Method for Modeling Valid Search Domains in Engineering Design Problems"
427,10.1115/DETC2011-48566,2011,http://proceedings.asmedigitalcollection.asme.org//proceeding.aspx?articleID=1640692,"Convex Estimators for Optimization of Kriging Model Problems"
428,10.1115/DETC2011-48579,2011,http://proceedings.asmedigitalcollection.asme.org//proceeding.aspx?articleID=1640694,"On Using Kriging Models for Complex Design"
429,10.1115/DETC2011-48608,2011,http://proceedings.asmedigitalcollection.asme.org//proceeding.aspx?articleID=1640696,"Surrogate Modeling of Complex Systems Using Adaptive Hybrid Functions"
430,10.1115/DETC2011-47247,2011,http://proceedings.asmedigitalcollection.asme.org//proceeding.aspx?articleID=1640701,"Fundamental Concepts for Product Designs Based on Pareto Optimum Solutions"
431,10.1115/DETC2011-47329,2011,http://proceedings.asmedigitalcollection.asme.org//proceeding.aspx?articleID=1640702,"Tracing the Envelope of the Objective-Space in Multi-Objective Topology Optimization"
434,10.1115/DETC2011-47819,2011,http://proceedings.asmedigitalcollection.asme.org//proceeding.aspx?articleID=1640706,"Simultaneous Requirement and Design Optimization of an Industrial Robot Family Using Multi-Objective Optimization"
435,10.1115/DETC2011-48333,2011,http://proceedings.asmedigitalcollection.asme.org//proceeding.aspx?articleID=1640710,"LIVE: A Work-Centered Approach to Support Visual Analytics of Multi-Dimensional Engineering Design Data With Interactive Visualization and Data-Mining"
436,10.1115/DETC2011-47237,2011,http://proceedings.asmedigitalcollection.asme.org//proceeding.aspx?articleID=1640713,"Multidisciplinary Design Optimization for Complex Engineered Systems Design: State of the Research and State of the Practice—Report From a National Science Foundation Workshop"
437,10.1115/DETC2011-47761,2011,http://proceedings.asmedigitalcollection.asme.org//proceeding.aspx?articleID=1640717,"Multidisciplinary Design Optimization of Ship Hull Forms Using Metamodels"
438,10.1115/DETC2011-47944,2011,http://proceedings.asmedigitalcollection.asme.org//proceeding.aspx?articleID=1640718,"Visually Exploring a Design Space Through the Use of Multiple Contextual Self-Organizing Maps"
439,10.1115/DETC2011-48196,2011,http://proceedings.asmedigitalcollection.asme.org//proceeding.aspx?articleID=1640720,"Multidisciplinary Design Optimization of Modular Industrial Robots"
440,10.1115/DETC2011-48318,2011,http://proceedings.asmedigitalcollection.asme.org//proceeding.aspx?articleID=1640722,"Sequential Sampling With Kernel-Based Bayesian Network Classifiers"
441,10.1115/DETC2011-48377,2011,http://proceedings.asmedigitalcollection.asme.org//proceeding.aspx?articleID=1640726,"Quantifying the Convergence Time of Distributed Design Processes"
442,10.1115/DETC2011-48521,2011,http://proceedings.asmedigitalcollection.asme.org//proceeding.aspx?articleID=1640728,"Co-Design of an Active Suspension Using Simultaneous Dynamic Optimization"
443,10.1115/DETC2011-48614,2011,http://proceedings.asmedigitalcollection.asme.org//proceeding.aspx?articleID=1640731,"Bounded Target Cascading in Hierarchical Design Optimization"
444,10.1115/DETC2011-47390,2011,http://proceedings.asmedigitalcollection.asme.org//proceeding.aspx?articleID=1640733,"Structural Optimization of Lattice Materials"
445,10.1115/DETC2011-47487,2011,http://proceedings.asmedigitalcollection.asme.org//proceeding.aspx?articleID=1640736,"Multiscale Design and Multiobjective Optimization of Orthopaedic Cellular Hip Implants"
446,10.1115/DETC2011-47983,2011,http://proceedings.asmedigitalcollection.asme.org//proceeding.aspx?articleID=1640738,"Shape Design of Periodic Cellular Materials Under Cyclic Loading"
447,10.1115/DETC2011-48000,2011,http://proceedings.asmedigitalcollection.asme.org//proceeding.aspx?articleID=1640741,"Optimization of Honeycomb Cellular Meso-Structures for High Speed Impact Energy Absorption"
448,10.1115/DETC2011-48790,2011,http://proceedings.asmedigitalcollection.asme.org//proceeding.aspx?articleID=1640743,"Shear Compliant Hexagonal Cellular Solids With a Shape Memory Alloy"
449,10.1115/DETC2011-47094,2011,http://proceedings.asmedigitalcollection.asme.org//proceeding.aspx?articleID=1640745,"Return on Investment Analysis for Implementing Barriers to Reverse Engineering"
450,10.1115/DETC2011-47743,2011,http://proceedings.asmedigitalcollection.asme.org//proceeding.aspx?articleID=1640748,"A Novel Search Algorithm for Interactive Automated Conceptual Design Generator (ACDG)"
451,10.1115/DETC2011-48390,2011,http://proceedings.asmedigitalcollection.asme.org//proceeding.aspx?articleID=1640751,"Object-Oriented Modeling of Industrial Manipulators With Application to Energy Optimal Trajectory Scaling"
452,10.1115/DETC2011-48395,2011,http://proceedings.asmedigitalcollection.asme.org//proceeding.aspx?articleID=1640753,"Analysis and Design of an In-Pipe System for Water Leak Detection"
453,10.1115/DETC2011-48568,2011,http://proceedings.asmedigitalcollection.asme.org//proceeding.aspx?articleID=1640755,"A Design Exploration of Genetically Engineered Myosin Motors"
454,10.1115/DETC2011-47472,2011,http://proceedings.asmedigitalcollection.asme.org//proceeding.aspx?articleID=1640758,"Identification of Product Family Platforms Using Pattern Recognition"
455,10.1115/DETC2011-47959,2011,http://proceedings.asmedigitalcollection.asme.org//proceeding.aspx?articleID=1640761,"Recent Advancements in Product Family Design and Platform-Based Product Development: A Literature Review"
456,10.1115/DETC2011-48060,2011,http://proceedings.asmedigitalcollection.asme.org//proceeding.aspx?articleID=1640763,"Platform Strategy for Product Family Design Using Particle Swarm Optimization"
457,10.1115/DETC2011-48194,2011,http://proceedings.asmedigitalcollection.asme.org//proceeding.aspx?articleID=1640767,"A Platform Selection Approach Based on Product Family Ontology Modeling"
458,10.1115/DETC2011-47200,2011,http://proceedings.asmedigitalcollection.asme.org//proceeding.aspx?articleID=1640769,"An Importance Sampling Approach for Time-Dependent Reliability"
459,10.1115/DETC2011-47234,2011,http://proceedings.asmedigitalcollection.asme.org//proceeding.aspx?articleID=1640771,"A Variable-Size Local Domain Approach for Concurrent Design Optimization and Model Validation Using Parametric Bootstrap"
460,10.1115/DETC2011-47238,2011,http://proceedings.asmedigitalcollection.asme.org//proceeding.aspx?articleID=1640773,"Addressing Limitations of Pareto Front in Design Under Uncertainty"
461,10.1115/DETC2011-47437,2011,http://proceedings.asmedigitalcollection.asme.org//proceeding.aspx?articleID=1640777,"Robustness of Residual Stresses in Brake Discs by Metamodeling"
462,10.1115/DETC2011-47537,2011,http://proceedings.asmedigitalcollection.asme.org//proceeding.aspx?articleID=1640780,"Equivalent Standard Deviation to Convert High-Reliability Model to Low-Reliability Model for Efficiency of Sampling-Based RBDO"
463,10.1115/DETC2011-47538,2011,http://proceedings.asmedigitalcollection.asme.org//proceeding.aspx?articleID=1640782,"Adaptive Virtual Support Vector Machine for the Reliability Analysis of High-Dimensional Problems"
464,10.1115/DETC2011-47855,2011,http://proceedings.asmedigitalcollection.asme.org//proceeding.aspx?articleID=1640785,"Robustness Metrics for Time-Dependent Quality Characteristics"
465,10.1115/DETC2011-47865,2011,http://proceedings.asmedigitalcollection.asme.org//proceeding.aspx?articleID=1640788,"Quantifying Model Uncertainty Using Measurement Uncertainty Standards"
466,10.1115/DETC2011-47888,2011,http://proceedings.asmedigitalcollection.asme.org//proceeding.aspx?articleID=1640790,"Multi-Stage Uncertainty Quantification for Verifying the Correctness of Complex System Designs"
467,10.1115/DETC2011-48314,2011,http://proceedings.asmedigitalcollection.asme.org//proceeding.aspx?articleID=1640791,"Resilience-Driven System Design of Complex Engineered Systems"
468,10.1115/DETC2011-48575,2011,http://proceedings.asmedigitalcollection.asme.org//proceeding.aspx?articleID=1640794,"Reliable Kinetic Monte Carlo Simulation Based on Random Set Sampling"
469,10.1115/DETC2011-48607,2011,http://proceedings.asmedigitalcollection.asme.org//proceeding.aspx?articleID=1640797,"Hybrid Power Generation System Design Optimization Based on a Markovian Reliability Analysis Approach"
470,10.1115/DETC2011-48623,2011,http://proceedings.asmedigitalcollection.asme.org//proceeding.aspx?articleID=1640799,"Improving Identifiability in Model Calibration Using Multiple Responses"
471,10.1115/DETC2011-48710,2011,http://proceedings.asmedigitalcollection.asme.org//proceeding.aspx?articleID=1640803,"Robust Structural Design Optimization Under Non-Probabilistic Uncertainties"
472,10.1115/DETC2010-28027,2010,http://proceedings.asmedigitalcollection.asme.org//proceeding.aspx?articleID=1610836,"Finite Element Modeling and Analysis of Orthotropic Butt Welds"
473,10.1115/DETC2010-28158,2010,http://proceedings.asmedigitalcollection.asme.org//proceeding.aspx?articleID=1610840,"Theoretical and Experimental Characterization of the 34.6 2D Lattice Material"
474,10.1115/DETC2010-28472,2010,http://proceedings.asmedigitalcollection.asme.org//proceeding.aspx?articleID=1610843,"A Viscoelastic Based Mechanism for Improving Spring-In Angle Predictions in Compression Molded Thermoplastic Matrix Composites"
475,10.1115/DETC2010-28494,2010,http://proceedings.asmedigitalcollection.asme.org//proceeding.aspx?articleID=1610845,"The Effect of Carbon Nanotubes on the Natural Frequencies of Microcantilever Beams"
476,10.1115/DETC2010-28549,2010,http://proceedings.asmedigitalcollection.asme.org//proceeding.aspx?articleID=1610848,"Experimental Damage Characterization of Hexagonal Honeycombs Subjected to In-Plane Shear Loading"
477,10.1115/DETC2010-28557,2010,http://proceedings.asmedigitalcollection.asme.org//proceeding.aspx?articleID=1610852,"Design of Chiral Honeycomb Meso-Structures for High Shear Flexure"
478,10.1115/DETC2010-28730,2010,http://proceedings.asmedigitalcollection.asme.org//proceeding.aspx?articleID=1610854,"A Study of the Effect of Geometry Changes on the Structural Stiffness of a Composite D-Spar"
479,10.1115/DETC2010-28731,2010,http://proceedings.asmedigitalcollection.asme.org//proceeding.aspx?articleID=1610857,"Low-Velocity Impact Behavior of Aluminum-Fiber/Epoxy Laminates: A Comprehensive Experimental Study"
480,10.1115/DETC2010-29186,2010,http://proceedings.asmedigitalcollection.asme.org//proceeding.aspx?articleID=1610859,"Safety of Spur Gear Design Under Non-Ideal Conditions With Uncertainty"
481,10.1115/DETC2010-28095,2010,http://proceedings.asmedigitalcollection.asme.org//proceeding.aspx?articleID=1610862,"Subfunctions as Parts of Functions: Some Formal Problems"
482,10.1115/DETC2010-28180,2010,http://proceedings.asmedigitalcollection.asme.org//proceeding.aspx?articleID=1610866,"Development and Application of a Patent-Based Design Around Process"
483,10.1115/DETC2010-28492,2010,http://proceedings.asmedigitalcollection.asme.org//proceeding.aspx?articleID=1610868,"A Port-Based Agent Approach to Guiding Concept Generation for Customizing Modular Varieties"
484,10.1115/DETC2010-28562,2010,http://proceedings.asmedigitalcollection.asme.org//proceeding.aspx?articleID=1610870,"Requirement Change Propagation Prediction Approach: Results From an Industry Case Study"
485,10.1115/DETC2010-28609,2010,http://proceedings.asmedigitalcollection.asme.org//proceeding.aspx?articleID=1610873,"A Graph Theory Based Method for Functional Decoupling of a Design With Complex Interaction Structure"
486,10.1115/DETC2010-28753,2010,http://proceedings.asmedigitalcollection.asme.org//proceeding.aspx?articleID=1610876,"Mass Customization: A Review of the Paradigm Across Marketing, Engineering and Distribution Domains"
487,10.1115/DETC2010-28775,2010,http://proceedings.asmedigitalcollection.asme.org//proceeding.aspx?articleID=1610879,"Automated Concept Generation Using Branched Functional Models"
488,10.1115/DETC2010-28818,2010,http://proceedings.asmedigitalcollection.asme.org//proceeding.aspx?articleID=1610882,"Development of Game Theoretic Protocols for Multilevel Design"
489,10.1115/DETC2010-28911,2010,http://proceedings.asmedigitalcollection.asme.org//proceeding.aspx?articleID=1610884,"Exploring Automated Concept Generator Output Through Principal Component Analysis"
490,10.1115/DETC2010-29068,2010,http://proceedings.asmedigitalcollection.asme.org//proceeding.aspx?articleID=1610886,"Concept Opportunity Diagrams: A Visual Modeling Method to Find Multifunctional Design Concepts"
491,10.1115/DETC2010-28242,2010,http://proceedings.asmedigitalcollection.asme.org//proceeding.aspx?articleID=1610889,"Modular Product Configuration: An Automatic Tool for Eliciting Design Knowledge From Parametric CAD Models"
492,10.1115/DETC2010-28528,2010,http://proceedings.asmedigitalcollection.asme.org//proceeding.aspx?articleID=1610892,"Reconfigurable Products and Their Means of Reconfiguration"
493,10.1115/DETC2010-28550,2010,http://proceedings.asmedigitalcollection.asme.org//proceeding.aspx?articleID=1610894,"Optimal Adaptable Design Considering Changes of Requirements, Configurations and Parameters in the Whole Product Life-Cycle"
495,10.1115/DETC2010-28723,2010,http://proceedings.asmedigitalcollection.asme.org//proceeding.aspx?articleID=1610897,"State Transition in Reconfigurable Systems"
496,10.1115/DETC2010-28739,2010,http://proceedings.asmedigitalcollection.asme.org//proceeding.aspx?articleID=1610899,"An Engineering Design Strategy for Reconfigurable Products That Support Poverty Alleviation"
497,10.1115/DETC2010-28490,2010,http://proceedings.asmedigitalcollection.asme.org//proceeding.aspx?articleID=1610902,"A Framework for Choice Modeling in Usage Context-Based Design"
498,10.1115/DETC2010-28662,2010,http://proceedings.asmedigitalcollection.asme.org//proceeding.aspx?articleID=1610904,"Product Family Deployment Through Optimal Resource Allocation Under Market System"
499,10.1115/DETC2010-28778,2010,http://proceedings.asmedigitalcollection.asme.org//proceeding.aspx?articleID=1610906,"Strategic Product Design Decisions for Uncertain Market Systems Using an Agent Based Approach"
500,10.1115/DETC2010-29032,2010,http://proceedings.asmedigitalcollection.asme.org//proceeding.aspx?articleID=1610909,"A Method for Supporting Service Design Based on Multiple Domain Knowledge"
501,10.1115/DETC2010-28102,2010,http://proceedings.asmedigitalcollection.asme.org//proceeding.aspx?articleID=1610912,"Parallel Biogeography-Based Optimization With GPU Acceleration for Nonlinear Optimization"
502,10.1115/DETC2010-28355,2010,http://proceedings.asmedigitalcollection.asme.org//proceeding.aspx?articleID=1610915,"Constraint Importance Mode Pursuing Sampling for Continuous Global Optimization"
503,10.1115/DETC2010-28475,2010,http://proceedings.asmedigitalcollection.asme.org//proceeding.aspx?articleID=1610916,"Design Preference Elicitation, Derivative-Free Optimization and Support Vector Machine Search"
504,10.1115/DETC2010-28601,2010,http://proceedings.asmedigitalcollection.asme.org//proceeding.aspx?articleID=1610919,"Protocol-Based Multi-Agent Systems: Examining the Effect of Diversity, Dynamism, and Cooperation in Heuristic Optimization Approaches"
505,10.1115/DETC2010-29085,2010,http://proceedings.asmedigitalcollection.asme.org//proceeding.aspx?articleID=1610921,"A Hybrid Biomimetic Genetic Algorithm Using a Local Fuzzy Simplex Search"
506,10.1115/DETC2010-28677,2010,http://proceedings.asmedigitalcollection.asme.org//proceeding.aspx?articleID=1610924,"Computation of the Usage Contexts Coverage of a Jigsaw With CSP Techniques"
507,10.1115/DETC2010-28712,2010,http://proceedings.asmedigitalcollection.asme.org//proceeding.aspx?articleID=1610927,"Visual Analysis of User Accommodation"
508,10.1115/DETC2010-28879,2010,http://proceedings.asmedigitalcollection.asme.org//proceeding.aspx?articleID=1610929,"Considering Secular and Demographic Trends in Designing for Present and Future Populations"
509,10.1115/DETC2010-29054,2010,http://proceedings.asmedigitalcollection.asme.org//proceeding.aspx?articleID=1610932,"Augmented Reality Visualization of Automobile Air Conditioning Using Optical Tracking Tools"
510,10.1115/DETC2010-28208,2010,http://proceedings.asmedigitalcollection.asme.org//proceeding.aspx?articleID=1610936,"Reverse Engineering for Spotting of Sheet Metal Forming Parts"
511,10.1115/DETC2010-28440,2010,http://proceedings.asmedigitalcollection.asme.org//proceeding.aspx?articleID=1610938,"2-D Path Planning for Direct Laser Deposition Process"
512,10.1115/DETC2010-28442,2010,http://proceedings.asmedigitalcollection.asme.org//proceeding.aspx?articleID=1610940,"A Multi-Axis Slicing Method for Direct Laser Deposition Process"
513,10.1115/DETC2010-28645,2010,http://proceedings.asmedigitalcollection.asme.org//proceeding.aspx?articleID=1610943,"Basic Study of Autologous-Bone-Replaceable Artificial Bone Fabrication With Porosity Distribution Using Electrolysis"
514,10.1115/DETC2010-28922,2010,http://proceedings.asmedigitalcollection.asme.org//proceeding.aspx?articleID=1610946,"Additive Manufacturing Based on Multiple Calibrated Projectors and Its Mask Image Planning"
515,10.1115/DETC2010-28205,2010,http://proceedings.asmedigitalcollection.asme.org//proceeding.aspx?articleID=1610949,"The Automated Planning for Fixture Location Based on Process Requirement"
519,10.1115/DETC2010-28261,2010,http://proceedings.asmedigitalcollection.asme.org//proceeding.aspx?articleID=1610952,"Robustness Analysis of Airfoil Performance"
521,10.1115/DETC2010-28338,2010,http://proceedings.asmedigitalcollection.asme.org//proceeding.aspx?articleID=1610954,"Symmetry Plane Detection for 3D CAD Volumes"
522,10.1115/DETC2010-28618,2010,http://proceedings.asmedigitalcollection.asme.org//proceeding.aspx?articleID=1610957,"Collision-Free Locating of Mobile Cranes in 3D Lifting System"
523,10.1115/DETC2010-28782,2010,http://proceedings.asmedigitalcollection.asme.org//proceeding.aspx?articleID=1610960,"A Fast Grid Deformation Algorithm for Aerodynamic Shape Optimization"
524,10.1115/DETC2010-28376,2010,http://proceedings.asmedigitalcollection.asme.org//proceeding.aspx?articleID=1610962,"Fundamental Concepts for Collaboratively Obtaining Optimum Product Designs"
